{
  "$schema": "https://athas.dev/schemas/extension.json",
  "id": "athas.typescript",
  "name": "TypeScript",
  "displayName": "TypeScript",
  "version": "1.0.0",
  "description": "TypeScript language support with LSP and tooling",
  "publisher": "Athas",
  "categories": ["Language"],
  "languages": [
    {
      "id": "typescript",
      "extensions": [".ts", ".mts", ".cts"],
      "aliases": ["TypeScript", "ts"]
    }
  ],
  "capabilities": {
    "lsp": {
      "name": "typescript-language-server",
      "runtime": "bun",
      "package": "typescript-language-server",
      "packages": ["typescript"],
      "args": ["--stdio"]
    },
    "formatter": {
      "name": "prettier",
      "runtime": "bun",
      "package": "prettier",
      "args": ["--stdin-filepath", "${file}"]
    },
    "linter": {
      "name": "eslint",
      "runtime": "bun",
      "package": "eslint",
      "args": ["--stdin", "--stdin-filename", "${file}", "--format", "json"]
    }
  }
}
