{
  "$schema": "https://athas.dev/schemas/extension.json",
  "id": "athas.swift",
  "name": "Swift",
  "displayName": "Swift",
  "version": "1.0.0",
  "description": "Swift language support with LSP",
  "publisher": "Athas",
  "categories": ["Language"],
  "languages": [
    {
      "id": "swift",
      "extensions": [".swift"],
      "aliases": ["Swift"]
    }
  ],
  "capabilities": {
    "lsp": {
      "name": "sourcekit-lsp",
      "runtime": "system",
      "args": []
    }
  }
}
