{
  "$schema": "https://athas.dev/schemas/extension.json",
  "id": "athas.elixir",
  "name": "Elixir",
  "displayName": "Elixir",
  "version": "1.0.0",
  "description": "Elixir language support with LSP",
  "publisher": "Athas",
  "categories": ["Language"],
  "languages": [
    {
      "id": "elixir",
      "extensions": [".ex", ".exs"],
      "aliases": ["Elixir"]
    }
  ],
  "capabilities": {
    "lsp": {
      "name": "elixir-ls",
      "runtime": "binary",
      "args": []
    }
  }
}
