{
  "$schema": "https://athas.dev/schemas/extension.json",
  "id": "athas.agent.qwen-code",
  "name": "Qwen Code",
  "displayName": "Qwen Code",
  "description": "Alibaba Qwen's command-line coding agent with native ACP support.",
  "version": "1.0.0",
  "publisher": "Alibaba",
  "categories": ["Agent"],
  "agents": [
    {
      "id": "qwen-code",
      "name": "Qwen Code",
      "binaryName": "qwen",
      "description": "Alibaba Qwen Code agent with native ACP support.",
      "args": ["--acp", "--experimental-skills"],
      "install": {
        "runtime": "node",
        "package": "@qwen-code/qwen-code@0.22.0",
        "version": "0.22.0",
        "command": "qwen"
      }
    }
  ]
}
