{
  "$schema": "https://athas.dev/schemas/extension.json",
  "id": "athas.cpp",
  "name": "C++",
  "displayName": "C++",
  "version": "1.0.0",
  "description": "C++ language support with LSP",
  "publisher": "Athas",
  "categories": ["Language"],
  "languages": [
    {
      "id": "cpp",
      "extensions": [".cpp", ".cc", ".cxx", ".hpp", ".hh", ".hxx"],
      "aliases": ["C++", "cpp"]
    }
  ],
  "capabilities": {
    "lsp": {
      "name": "clangd",
      "runtime": "binary",
      "args": ["--background-index"]
    }
  }
}
